Judul,Tanggal,Link,Isi Berita,Label
Polisi Ungkap 'Tradisi' Kekerasan Geng Siswa Binus School Serpong,"Jumat, 01 Mar 2024 11:40 WIB",https://www.cnnindonesia.com/nasional/20240301111409-12-1069157/polisi-ungkap-tradisi-kekerasan-geng-siswa-binus-school-serpong,"Polisi Ungkap 'Tradisi' Kekerasan Geng Siswa Binus School Serpong. Kepolisian Resor Tangerang Selatan mengungkap beragam kekerasan yang menjadi 'tradisi' dalam geng siswa di Binus School Serpong. Korban perundungan atau bullying oleh sesama siswa ini pun mengalami sejumlah luka.Aksi bullying itu dialami korban pada 2 Februari dan dilakukan oleh 12 orang di warung belakang Binus School Serpong. ""Para pelaku secara bergantian melakukan kekerasan terhadap anak korban dengan dalih 'tradisi' tidak tertulis sebagai tahapan untuk bergabung dalam kelompok atau komunitas,"" kata Kasat Reskrim Polres Tangerang Selatan AKP Alvino Cahyadi kepada wartawan, Jumat (1/3). ""Dengan cara menjambak rambut, memberikan arahan atau instruksi untuk melepaskan celana, mencubit bagian dada, memukul perut dengan posisi jari tangan yang dikepal, memukul kepala dengan posisi jari tangan yang dikepal, menarik kerah baju, mengelitik perut, memukul perut, menendang kaki, memukul wajah,"" lanjutnya.Berselang 10 hari kemudian, atau pada 12 Februari, korban menceritakan aksi kekerasan yang dialaminya kepada sang kakak. Keesokan harinya atau pada 13 Februari, para pelaku mengetahui bahwa korban telah menceritakan aksi kekerasan itu kepada kakaknya. Hal itu membuat enam pelaku tidak terima dan kembali melakukan aksi kekerasan kepada korban. ""Pelaku yang berjumlah enam orang tidak terima dan kembali melakukan tindakan kekerasan kepada anak korban dengan cara menyundut korek yang sudah dipanaskan ke lengan kiri korban, memiting leher korban, memukul perut korban, dan mendorong badan korban,"" ucap Alvino. Akibat aksi kekerasan itu, korban mengalami sejumlah luka-luka. Berdasarkan visum, korban mengalami luka memar di leher, luka lecet di leher, luka bekas sundutan rokok pada leher bagian belakang, dan luka bakar pada lengan tangan kiri.Dalam kasus ini, polisi telah menetapkan empat orang tersangka dan delapan anak berkonflik dengan hukum (ABH). Penetapan ini berdasarkan hasil gelar perkara yang dilakukan oleh penyidik Unit PPA Sat Reskrim Polres Tangerang Selatan, Kamis (29/2) kemarin. Untuk empat tersangka itu masing-masing berinisial E (18), R (18), J (18) dan G (19). Sedangkan untuk delapan ABH tak dibeberkan identitas. ""Total yang ditetapkan 12 orang dengan rincian 8 anak berkonflik dengan hukum dan 4 orang tersangka,"" kata Alvino. Kedua belas orang tersebut dijerat dengan Pasal 76C Jo Pasal 80 UU Nomor 35 Tahun 2014 tentang Perlindungan Anak menjadi Undang-undang dan atau Pasal 170 KUHP dan atau Pasal 4 ayat 2 huruf d Jo Pasal 5 UU Nomor 12 Tahun 2022 tentang Tindak Pidana Kekerasan Seksual. Binus School Serpong menyatakan telah memberi sanksi kepada para siswa yang terlibat kasus bullying tersebut.Hubungan Masyarakat Binus School Education, Haris Suhendra mengatakan sanksi itu diambil setelah pihaknyaa menyelidiki perundungan tersebut. ""Seluruh siswa yang terbukti melakukan tindakan kekerasan sudah tidak menjadi bagian dari komunitas Binus School. Sejumlah siswa lain yang turut menyaksikan kejadian tersebut tanpa melakukan tindakan pencegahan maupun pertolongan juga telah mendapatkan sanksi disiplin keras,"" kata Haris dalam keterangan tertulis, Rabu (21/2).",Teman
Keluarga Santri Kediri Tak Puas Rekonstruksi: Jangan Ada yang Ditutupi,"Jumat, 01 Mar 2024 11:21 WIB",https://www.cnnindonesia.com/nasional/20240301104019-12-1069134/keluarga-santri-kediri-tak-puas-rekonstruksi-jangan-ada-yang-ditutupi,"Keluarga Santri Kediri Tak Puas Rekonstruksi: Jangan Ada yang Ditutupi. Keluarga santri Bintang Balqis Maulana (14) yang tewas akibat dianiaya empat orang senior sesama santri di Pondok Pesantren Tartilul Quran (PPTQ) Al Hanifiyyah Desa Kranding, Kecamatan Mojo, Kabupaten Kediri, mengaku tak puas dengan hasil rekonstruksi kematian korban.Polres Kediri Kota telah menggelar rekonstruksi tewasnya santri asal Glenmore, Banyuwangi itu di mapolres. Setidaknya ada 55 adegan yang diperagakan. Rekonstruksi berjalan tertutup karena alasan para tersangka masih di bawah umur. ""Iya, tidak puas, karena saya harus menyaksikan sendiri di TKP (tempat kejadian perkara),"" kata Ibu korban, Suyanti (38) saat dikonfirmasi CNNIndonesia.com, Jumat (1/3).Suyanti mengatakan pihaknya menginginkan agar rekonstruksi dilakukan ulang di tempat kejadian sebenarnya, yakni di Pondok Pesantren Tartilul Quran (PPTQ) Al Hanifiyyah, bukan di mapolres. ""Iya, kalau saya [ingin rekonstruksi] harus diadakan di tempat kejadian perkara. Dan jangan ada yang ditutup-tutupi,"" ucapnya. Suyanti dan pihak keluarga pun berencana bertolak ke Kediri awal pekan depan. Ia berharap polisi mau memfasilitasi dan mengabulkan rekonstruksi ulang itu. ""Kedatangan saya ke Kediri hari Senin (4/3) harus ada rekonstruksi ulang di TKP dengan sebenar-benarnya,"" ucapnya. Tak hanya itu, Suyanti juga menilai ada adegan yang kurang dari rekonstruksi itu. Yakni saat korban terakhir kali menghubunginya dengan perangkat telepon pondok, sebelum meninggal. Tak hanya itu, dia juga meragukan fakta rekonstruksi yang menyebut para tersangka hanya berbekal tangan kosong saat menganiaya anaknya. Pasalnya, kata Suyanti, selain luka dan lebam di kepala serta tubuh bagian atas jenazah anaknya, terdapat juga banyak luka sundutan rokok di kaki korban. Hal itu ia lihat sendiri. ""[Pelaku hanya pakai tangan kosong] sangat-sangat bohong sekali. Soalnya yang saya tahu, saya lihat di kaki anak saya ada sundutan rokok,"" ujar dia. Kini, Suyanti hanya ingin ada titik terang di kasus kematian anak ketiganya ini. Ia juga berharap para pelaku dihukum setimpal. ""Mudah-mudahan ada titik terang, saya tidak mau menambahi dan mengurangi, karena dengan kepergian anak saya itu sudah membuat saya sakit sekali,"" ucap dia. ""Saya ingin dihukum berat semua pihak tersangka dan yang menutup-nutupi kejadian ini,"" tambah Suyanti.Sebelumnya, Polres Kediri Kota bersama kejaksaan menggelar rekonstruksi kasus penganiayaan maut Bintang di Mapolres Kediri secara tertutup, Kamis (29/2). Reka adegan diperagakan oleh keempat tersangka yakni MN (18), MA (18), AF (16) dan AK (17). Kapolres Kediri Kota AKBP Bramastyo Priaji mengatakan, rekonstruksi itu total memeragakan 55 adegan. Dalam rekonstruksi itu juga, terungkap Bintang dianiaya selama tiga hari hingga akhirnya tewas. Korban mendapatkan kekerasan fisik dan pukulan dari para tersangka.Keempat pelaku diduga menggunakan tangan kosong saat menganiaya korban. Pukulan dan kekerasan kebanyakan didaratkan di area setengah badan ke atas. ""Sementara [penganiayaan dilakukan] menggunakan tangan kosong, jadi benda tumpul yang sesuai dengan keterangan dokter menerima, sehingga terjadinya luka di tubuh korban,"" kata Bramastyo.",Teman
"Bullying Binus School Serpong, Polisi Tetapkan 4 Tersangka dan 8 ABH","Jumat, 01 Mar 2024 11:09 WIB",https://www.cnnindonesia.com/nasional/20240301110302-12-1069153/bullying-binus-school-serpong-polisi-tetapkan-4-tersangka-dan-8-abh,"Bullying Binus School Serpong, Polisi Tetapkan 4 Tersangka dan 8 ABH. Polisi menetapkan empat orang tersangka dan delapan anak berkonflik dengan hukum (ABH) dalam kasus dugaan bullyinga atau perundungan terhadap siswa di Binus School Serpong. Penetapan ini berdasarkan hasil gelar perkara yang dilakukan oleh penyidik Unit PPA Sat Reskrim Polres Tangerang Selatan, Kamis (29/2) kemarin. ""Total yang ditetapkan 12 orang dengan rincian 8 anak berkonflik dengan hukum dan 4 orang tersangka,"" kata Kasat Reskrim Polres Tangsel AKP Alvino Cahyadi kepada wartawan, Jumat (1/3). Untuk empat tersangka itu masing-masing berinisial E (18), R (18), J (18) dan G (19). Sedangkan untuk delapan ABH tak dibeberkan identitas. ""(Yang empat tersangka), satu sudah tidak bersekolah di SMA swasta, tiga masih,"" ucap Alvino. 12 orang tersebut dijerat Pasal 76C Jo Pasal 80 UU Nomor 35 Tahun 2014 tentang Perlindungan Anak menjadi Undang-undang dan atau Pasal 170 KUHP dan atau Pasal 4 ayat 2 huruf d Jo Pasal 5 UU Nomor 12 Tahun 2022 tentang Tindak Pidana Kekerasan Seksual. Sebelumnya, seorang siswa Binus School Serpong dilarikan ke rumah sakit karena diduga menjadi korban perundungan oleh seniornya sebagai syarat untuk masuk geng. Aksi perundungan diduga terjadi di warung belakang Binus School. Korban yang merupakan calon anggota geng disebut harus melakukan beberapa hal yang diminta oleh senior, termasuk mendapat kekerasan fisik.Dari pemeriksaan awal, pelaku perundungan diduga lebih dari satu orang. Kemudian, dari hasil visum juga ditemukan sejumlah luka memar hingga bekas luka bakar pada tubuh korban. Sementara itu, Binus School Serponga membenarkan anak dari artis Vincent Rompies turut terlibat dalam kasus bullying di Binus School Serpong. Tak hanya itu, imbas aksi perundungan itu Binus School Serpong juga telah melakukan investigasi dan memberikan sanksi kepada mereka yang diduga terlibat. ""Seluruh siswa yang terbukti melakukan tindakan kekerasan sudah tidak menjadi bagian dari komunitas Binus School. Sejumlah siswa lain yang turut menyaksikan kejadian tersebut tanpa melakukan tindakan pencegahan maupun pertolongan juga telah mendapatkan sanksi disiplin keras,"" kata Hubungan Masyarakat Binus School Education, Haris Suhendra dalam keterangan tertulis, Rabu (21/2).",Teman
"Ada 3 Kasus Penganiayaan Santri di Jatim Awal 2024, Tewas 2 Orang","Jumat, 01 Mar 2024 06:27 WIB",https://www.cnnindonesia.com/nasional/20240229191545-12-1068965/ada-3-kasus-penganiayaan-santri-di-jatim-awal-2024-tewas-2-orang,"Ada 3 Kasus Penganiayaan Santri di Jatim Awal 2024, Tewas 2 Orang - Kantor Wilayah Kementerian Agama (Kemenag) Jawa Timur mengaku sudah mendapatkan tiga laporan kasusa penganiayaan terhadap santri yang terjadi di Jawa Timur sepanjang Januari-Februari 2024. ""Ada tiga kejadian. Blitar, Kediri sama Malang,"" kata Kabid Pendidikan Diniyah dan Pondok Pesantren Kanwil Kemenag Jatim, Mohammad As'adul Anam saat konferensi pers, Kamis (29/2). Kasus pertama terjadi Januari lalu di salah satu pesantren di Sutojayan, Kabupaten Blitar. Korbannya berinisial MAR (13) yang dinyatakan meninggal dunia setelah dianiaya 17 orang sesama santri.        Motif pengeroyokan, yakni korban diduga melakukan pencurian barang teman-temannya yang mengakibatkan mereka melakukan tindakan fisik pada korban. Akibat kejadian itu, korban yang mengalami luka berat hingga koma sebelum meninggal .Kasus kedua terjadi di salah satu pesantren di Malang. Korbannya adalah ST (15) yang mengalami luka bakar setelah disetrika seniornya berinisial AF (19). ""Kalau yang di Malang awalnya dari gurauan menggunakan setrika, hingga akhirnya mengenai temannya dan mengakibatkan luka bakar,"" ujarnya. Kasus ketiga, yang baru terjadi di Ponpes PPTQ Al Hanifiyyah, Desa Kranding, Kecamatan Mojo, Kabupaten Kediri. Korbannya berinisial Bingang Balqis Maulana (14) yang meninggal dunia setelah dianiaya empat seniornya. Anam mengatakan pola kasus yang terjadi di Kabupaten Blitar dengan kasus yang terjadi di Kabupaten Kediri hampir sama. ""Yang Blitar ini hampir sama dengan Kediri. Cuma motifnya yang berbeda. Kalau di Kediri belum tahu motifnya,"" ujarnya. Anam berharap aparat kepolisian bisa menuntaskan kasus ini secara terang benderang. Hal itu agar masyarakat tetap percaya pada lembaga pesantren. ""Kami sangat menghormati proses hukum dan kami menunggu tahapan-tahapan berikutnya, sehingga masyarakat dapat mendapatkan penyelesaian secara gamblang. Sehingga kegeraman masyarakat bisa terselesaikan,"" ucapnya. Sebagai langkah antisipasi, Kemenag Kanwil Jatim mengaku telah menjalankan beberapa program. Di antaranya sosialisasi pesantren ramah santri atau ramah anak bersama RMI PWNU Jawa Timur sejak 2022. Mereka juga bekerjasama dengan DPRD Jawa Timur, melakukan pelatihan satgas pesantren ramah santri atau anak di 7 wilayah kerja atau 840 pesantren. Dan bekerjasama dengan Unicef terkait penanganan kekerasan fisik dan seksual di Jatim.a ",Teman
Ruang Gelap Aksi Kekerasan Maut di Lingkungan Pesantren,"Kamis, 29 Feb 2024 13:50 WIB",https://www.cnnindonesia.com/nasional/20240229130102-12-1068740/ruang-gelap-aksi-kekerasan-maut-di-lingkungan-pesantren,"Ruang Gelap Aksi Kekerasan Maut di Lingkungan Pesantren. Kasus kekerasan atau perundungan (bullying) hingga berujung korban jiwa di lingkungan Pondok Pesantren (Ponpes) masih terus terjadi, termasuk yang terbaru di Kediri, Jawa Timur.Kementerian Agama (Kemenag) dinilai 'kecolongan' karena gagal menjalankan fungsi pengawasan dan pembinaan.Baru-baru ini publik dikejutkan oleh kasus kematian Bintang Balqis Maulana (14), santri asal Banyuwangia yang mondok di Pesantren PPTQ Al Hanifiyyah, Mojo, Kediri. Almarhum tewas dengan kondisi banyak luka lebam dan robek di tubuhnya. Polisi kemudian menetapkan total 4 tersangka yang merupakan sesama santri hingga senior korban dalam kasus tersebut. Rinciannya yakni MN (18) asal Sidoarjo, MA (18) asal Nganjuk, AK (17) dari Kota Surabaya, dan AF (16) sepupu korban asal Denpasar. Kasus kekerasan yang terjadi di lingkungan pesantren itu menambah catatan masih berulangnya perundungan atau penganiayaan berujung maut di lingkungan pesantren yang masih terus berulang.Berdasarkan data Catatan Akhir Tahun Federasi Serikat Guru Indonesia (FSGI) disepanjang 2023, setidaknya terdapat 30 kasus perundungan dengan kekerasan yang dilaporkan ke Polisi.FSGI mencatat dari jumlah tersebut sebanyak 20 persen kasus perundungan dengan kekerasan justru terjadi di satuan pendidikan yang berada di bawah naungan Kemenag.Salah satu kasus kekerasan hingga berujung korban jiwa terjadi di Ponpes Husnul Khotimah,a Kuningan, Jawa Barat, pada 4 Desember 2023. Ketika itu salah satu santri berinisial MHAD (18), meninggal dunia diduga korban pengeroyokan temannya sesama santri. Selain itu, kasus serupa juga pernah dialami oleh salah satu Ponpes di Pringsurat, Temanggung, Jawa Tengah. Santri berinisial N ditemukan meninggal usai diduga dianiaya teman satu kamar karena mencuri uang temannya, pada 10 September 2023.Pengamat Pendidikan dari Universitas Negeri Semarang Edi Subkhana menilai kasus kekerasan di lingkungan ponpes banyak dipengaruhi oleh kultur ataupun hierarki yang ada di antara para santri junior dan senior. Ia menjelaskan dalam banyak kasus di pelbagai pesantren, para santri junior kerap didoktrin agar tidak memprotes seluruh tindakan yang dilakukan senior. Kondisi itu, kata dia, sering kali diperparah dengan kurangnya kepekaan dari pesantren untuk meminimalisasi potensi konflik yang terjadi. ""Terulangnya kasus kekerasan ini karena pihak pesantren kurang peka terhadap potensi konflik yang bisa muncul dalam pergaulan antar santri,"" jelasnya kepada CNNIndonesia.com, Rabu (28/2). Menurut Edi kasus-kasus kekerasan di lingkungan pesantren yang mencuat ke publik saat ini hanya puncak gunung es. Ia meyakini masih banyak aksi kekerasan yang dialami santri, namun tidak pernah muncul ke permukaan. ""Senioritas terjadi di mana saja termasuk di sekolah umum. Namun di pesantren terdapat hirarki dan kultur yang seringkali mengarahkan santri junior untuk menerima dan tidak banyak protes,"" jelasnya. ""Hal ini yang bisa jadi menjadikan perundungan dan kekerasan terjadi dan tidak banyak muncul. Karena santri tidak dibiasakan untuk bersuara,"" imbuhnya. Sementara itu, Pengamat Pendidikan dari Universitas Islam Negeri (UIN) Syarif Hidayatullah Jakarta Jejen Musfah menilai banyaknya aksi kekerasan lantaran pesantren terlalu fokus pada pendidikan agama dan akademik. Jejen tidak menampik apabila selama ini memang kerap masih ditemukan hierarki dan kultur senioritas di antara para santri. Hanya saja, kata dia, hal tersebut bisa diatasi sejumlah Pondok Pesantren dengan meningkatkan program pendidikan karakter ataupun antikekerasan di antara santri. ""Sebabnya adalah lemahnya komitmen pengajar dan orang tua dalam pendidikan karakter. Juga lemahnya upaya kerja sama pesantren dan rumah untuk mengembangkan karakter anak,"" tutur Jejen.",Teman
Polisi Sudah Periksa 17 Saksi Usut Kasus Bullying Binus School Serpong,"Kamis, 29 Feb 2024 00:05 WIB",https://www.cnnindonesia.com/nasional/20240228170656-12-1068426/polisi-sudah-periksa-17-saksi-usut-kasus-bullying-binus-school-serpong,"Polisi Sudah Periksa 17 Saksi Usut Kasus Bullying Binus School Serpong. Polisi telah memeriksa 17 orang saksi untuk mengusut kasus dugaan bullying atau perundungan terhadap siswa di Binus School Serpong.""Sementara 17 orang telah diperiksa,"" kata Kasi Humas Polres Tangsel AKP Wendi ketika dihubungi, Rabu (28/2). Wendi menuturkan hari ini penyidik Unit PPA Sat Reskrim Polres Tangerang Selatan juga mengagendakan pemeriksaan sejumlah saksi. Kendati demikian, ia belum membeberkan ada berapa saksi yang hadir memenuhi panggilan. ""Yang jelas diagendakan terhadap saksi ahli dan pihak sekolah kembali,"" ucap dia. Sebelumnya, seorang siswa Binus School Serpong dilarikan ke rumah sakit karena diduga menjadi korban perundungan oleh seniornya sebagai syarat untuk masuk geng. Aksi perundungan diduga terjadi di warung belakang Binus School. Korban yang merupakan calon anggota geng disebut harus melakukan beberapa hal yang diminta oleh senior termasuk mendapati kekerasan fisik. Dari pemeriksaan awal, pelaku perundungan ini diduga lebih dari satu orang. Kemudian, dari hasil visum juga ditemukan sejumlah luka memar hingga bekas luka bakar pada tubuh korban. Polisi pun telah meningkatkan kasus ini ke tahap penyidikan. Polisi menemukan ada unsur pidana terkait dugaan pelanggaran Pasal 76C Jo Pasal 80 UU Nomor 35 Tahun 2014 atas perubahan UU Nomor 23 Tahun 2002 tentang Perlindungan Anak menjadi Undang-undang dan/atau Pasal 170 KUHP. Sementara itu, Binus School Serpong juga membenarkan anak dari artis Vincent Rompies turut terlibat dalam kasus bullying di Binus School Serpong .Tak hanya itu, imbas aksi perundungan itu Binus School Serpong juga telah melakukan investigasi dan memberikan sanksi kepada mereka yang diduga terlibat. ""Seluruh siswa yang terbukti melakukan tindakan kekerasan sudah tidak menjadi bagian dari komunitas Binus School. Sejumlah siswa lain yang turut menyaksikan kejadian tersebut tanpa melakukan tindakan pencegahan maupun pertolongan juga telah mendapatkan sanksi disiplin keras,"" kata Hubungan Masyarakat Binus School Education, Haris Suhendra dalam keterangan tertulis, Rabu (21/2).",Teman
Motif Penganiayaan Santri Kediri Hingga Tewas Versi Tersangka,"Rabu, 28 Feb 2024 13:12 WIB",https://www.cnnindonesia.com/nasional/20240228125702-12-1068243/motif-penganiayaan-santri-kediri-hingga-tewas-versi-tersangka,"Motif Penganiayaan Santri Kediri Hingga Tewas Versi Tersangka. Pengacara empat pelakua penganiayaana santri di Kediria hingga tewas, Rini Puspitasari, mengungkap kronologi dan motif kekerasan yang mengakibatkan meninggalnya Bintang Balqis Maulana (14) di Pondok Pesantren Tartilul Quran (PPTQ) Al-Hanifiyyah, Mojo, Kabupaten Kediri. Rini mengatakan, penganiayaan terhadap santri asal Banyuwangi itu bermula saat para pelaku mengaku merasa susah menasihati Bintang, terutama perkara salat berjemaah. Keempat pelaku itu adalah MN (18), MA (18), AK (17) dan AF (16) sepupu korban. ""Keterangan anak-anak (para pelaku) mengakui memukul dan tidak niat biar Bintang sampai gimana. Itu benar-benar emosi sesaat, karena Bintang diomongi tidak manut (nurut),"" kata Rini, saat dikonfirmasi, Rabu (28/2). Para pelaku dan korban tinggal dalam satu kamar di ponpes asuhan Fatihunada alias Gus Fatih itu. Awalnya dua pelaku mengetahui Bintang tidak salat, mereka pun menasihatinya. Peristiwa awal itu terjadi Rabu (21/2). ""Bintang itu baru sembuh dari sakit. Kemudian beberapa hari tidak sekolah dan tidak salat jemaah. Mereka ini kan satu kamar. Awalnya itu yang dapat info itu AK dan AF sepupunya. Kemudian menegur si Bintang. Ditanyai, kamu kenapa tidak salat? Bintang jawabnya itu tidak nyambung,"" ujarnya. Karena tak puas dengan jawaban korban, para pelaku kemudian emosi dan melakukan pemukulan kepada Bintang. Perbuatan itu diklaim dilakukan dengan tangan kosong.""Kamu salat. Waktu diomongi itu, [jawaban korban] 'cuma iyo-iyo mas'. Mungkin karena jawabannya tidak nyambung itu, [pelaku] sempat emosi. Kemudian memukul dengan tangan kosong dan menampar,"" ujarnya. Keesokan harinya, Kamis (21/2) para pelaku mendapati Bintang tidak salat jemaah lagi. Mereka kemudian menyuruh korban untuk salat dan mandi terlebih dahulu. Korban pun bergegas ke kamar mandi.Tetapi saat keluar kamar mandi, korban dalam keadaan telanjang dan diketahui oleh salah satu pelaku. Di sanalah korban mengalami penganiayaan oleh empat pelaku. ""Keluar dari kamar mandi Bintang itu telanjang. Kemudian oleh salah satu pelaku dirangkul dan dibawa ke kamar. Kemudian diomongi lagi dan Bintang jawabannya tidak nyambung. 'Iya-iya' gitu tok, tapi tidak dilaksanakan. Terus sempat melotot, akhirnya dipukul lagi,"" ujarnya Kamis malam (21/2) pelaku sempat mengobati luka-luka korban usai pemukulan. Mereka juga sempat berniat untuk membawa korban ke rumah sakit, tapi hal itu urung dilakukan. Saat itu lah kondisi korban mulai melemah. ""Kemudian hari Jumat (22/2) jam 03.00 WIB si AF (sepupu korban) dibangunin. Diomongin, kok Bintang tambah pucat. Lalu dibawa ke rumah sakit. Terus di rumah sakit ternyata kan meninggal,"" kata Rini. Mengetahui Bintang meninggal dunia di Rumah Sakit Arga Husada Ngadiluwih, Kabupaten Kediri, AF pun melapor ke pengasuh PPTQ Al-Hanifiyyah, Gus Fatih. ""Kemudian jenazahnya dibawa ke pondok, lalu dimandikan dan dikafani dibawa ke Banyuwangi hari Jumat setelah salat Jumat. Lalu disana heboh itu dan dilaporkan ke polisi,""jelas Rini. Rini mengklaim, pada saat mengantar jenazah korban ke Banyuwangi, AF sempat ditanya oleh ibu Bintang dan dia berbicara apa adanya. Dia mengaku telah memukuli sepupunya tersebut. Hal itu juga sudah diakui tersangka saat menjalani pemeriksaan polisi. ""Saat saya dampingi dia bilang apa-adanya. Tidak bilang korban terpeleset. Saya tidak tahu kalau dia beralibi terpeleset. Tapi pada saat bersama saya di BAP itu, dia mengakui memukul,"" ucapnya. Kini, kata Rini, para pelaku menyesal telah menganiaya Bintang dan merasa kebingungan. Bahkan, salah satu pelaku AK merasa syok, karena dia yang pertama kali memulai pemukulan dan tidak menduga korban sampai meninggal dunia. ""Mereka merasa menyesal dan merasa bersalah. Mereka sangat terpukul. Saat ngobrol sama saya, mereka diam dan menunduk. Salah satunya itu malah sulit untuk berkata-kata, karena dia yang memulai itu,"" ujar dia. Sebagai pengacara yang ditunjuk, Rini berharap kasus ini diungkap secara transparan. Ia juga berusaha mendampingi para pelaku dengan sebaik-baiknya, agar hak-hak mereka sebagai anak yang bermasalah dengan hukum bisa terpenuhi. ""Kita inginnya apa adanya. Benar-benar transparan. Kemudian anak-anak juga hak-haknya terpenuhi. Mudah mudah nanti ada jalan,"" pungkasnya. Sebelumnya, seorang santri Pesantren PPTQ Al Hanifiyyah, Mojo, Kabupaten Kediri, bernama Bintang Balqis Maulana (14) asal Desa Karangharjo, Kecamatan Glenmore, Banyuwangi tewas dengan kondisi tubuh mengenaskan. Awalnya, pihak pesantren dan pengantar jenazah menyebut Bintang meninggal usai jatuh terpeleset di kamar mandi. Tapi keluarga curiga setelah melihat darah yang mengucur dari keranda jenazah. Saat kain kafan dibuka, terlihat luka dan lebam di sekujur tubuh korban. Polres Kediri Kota pun menetapkan empat tersangka dalam kematian Bintang. Mereka yakni MN (18) asal Sidoarjo, MA (18) asal Nganjuk, AK (17) dari Kota Surabaya dan AF (16) sepupu korban asal Denpasar. Keempatnya merupakan teman sesama santri yang juga kakak kelas korban dalam menempuh pendidikan di pesantren PPTQ Al Hanifiyyah.",Teman
"Pria Ditangkap usai Perkosa 5 Ponakan, Terungkap usai Bocah Bicara","Sabtu, 24 Feb 2024 13:47 WIB",https://www.cnnindonesia.com/nasional/20240224122557-12-1066787/pria-ditangkap-usai-perkosa-5-ponakan-terungkap-usai-bocah-bicara,"Pria Ditangkap usai Perkosa 5 Ponakan, Terungkap usai Bocah Bicara. Seorang pria berinisial AF alias Abas di Ambon, Maluku, ditangkapa karena memperkosa lima orang keponakan.Kasus ini terungkap setelah seorang bocah berinisial RW (9) yang menjadi korban pemerkosaan di rumah pelaku pada 13 Februari 2024 sekitar pukul 20:00 WIT melaporkan ke polisi. AF ditangkap saat sempat bersembunyi di rumahnya pada Selasa, (19/2). ""Pelaku akhirnya berhasil ditangkap dan langsung diproses hukum sesuai hukum yang berlaku,""ujar Kasi Humas Polresta Pulau Ambon dan Pulau-pulau Lease, IPDA Janete S Luhukay melalui keterangan tertulis, Sabtu (24/2).        Ia bilang AF masih memiliki hubungan keluarga dengan para bocah yang diperkosa. RW (9) diperkosa di rumah RW yang ditinggali AF. Sementara, HL, AW, DW dan AT diperkosa di lokasi berbeda yakni di sebuah Desa di Kecamatan Baguala Kota Ambon. Aksi pemerkosaan terbongkar setelah RW (9) menceritakan kepada sang ayah NW. RW bilang selain dirinya diperkosa, AF juga memperkosa HL, AW, DW dan AT. ""Korban merupakan anak-anak di bawah umur masih hubungan kekeluargaan dengan pelaku,"" kata dia. Kala itu, RW (9) diperkosa di rumah pelaku, sebelum diperkosa RW sedang asik nonton tv di ruangan tamu. RW kemudian dipanggil AF masuk kamar untuk menemani AF bercerita. ""Kejadian itu terjadi terhadap salah satu korban berinisial RW bocah 9 tahun sekitar pukul 20.00 wit di rumah NW yang juga ditempati oleh pelaku tepatnya di dalam kamar,"" kata dia. ""Awalnya korban sementara nonton TV kemudian dipanggil oleh pelaku untuk bermain di dalam kamar bersama pelaku,""imbuh dia. Atas perbuatan, AF dijerat dengana delik persetubuhan dan percabulan terhadap anak di bawah umur dalam Pasal 81 Ayat (2) dan 82 Ayat (1) UU RI No 17 Tahun 2016 Tentang Perlindungan Anak.",Keluarga
