Judul,Tanggal,Link,Isi Berita,Label
Anak Perempuan Pinkan Mambo Klaim Jadi Korban Pelecehan Ayah Tiri,"Rabu, 26 Jul 2023 21:12 WIB",https://www.cnnindonesia.com/hiburan/20230726210027-234-978292/anak-perempuan-pinkan-mambo-klaim-jadi-korban-pelecehan-ayah-tiri,"Anak Perempuan Pinkan Mambo Klaim Jadi Korban Pelecehan Ayah Tiri. Anak perempuan Pinkan Mamboa mengaku pernah mengalami pelecehan yang dilakukan ayah tiri semasa kecil. Hal itu ia ungkapkan saat jadi bintang tamu dalam kanal YouTube Nadia Alaydrus pada Selasa (25/7). Ia merupakan anak kedua dari pernikahan Pinkan Mambo bersama Sandy Sanjaya. Namun, keduanya bercerai pada 2009 setelah empat tahun bersama. Anak perempuannya itu kini bercerita mendapatkan pelecehan seksual saat masih di bawah umur. Ia mengaku akhirnya buka suara karena sudah terjadi berulang kali.""Ada kejadian di keluarga aku di mana aku jadi korban oleh suami mama aku, suami yang kedua,"" curhat anak perempuan Pinkan Mambo tersebut kepada Nadia. CNNIndonesia.com sudah mendapatkan izin dari pihak anak Pinkan Mambo untuk mengutip pembicaraan tersebut. Redaksi juga sudah meminta izin Nadia Alaydrus untuk mengutip video YouTube. Redaksi juga telah menghubungi Pinkan Mambo terkait klaim anak perempuannya itu, tapi belum direspons hingga berita ini dirilis. Anak perempuan Pinkana Mambo itu membeberkan pelecehan seksual yang dilakukan ayah tirinya terjadi saat ia berusia sekitar 12 hingga 13 tahun. Namun, perbuatan itu disebut terjadi pada rentang waktu 2018 hingga 2021. ""Kejadiannya terjadi di 2018 sampai 2021, bisa dibilang sexual assault. Saat itu usiaku masih 12 atau 13 tahun waktu itu"" ungkap anak perempuan Pinkan. Ia mengaku semua bermula ketika ibunya tak berada di rumah. Sepengetahuannya, ia di rumah hanya bersama kakak dan adik tirinya. Ia tak tahu bahwa ayah tirinya juga berada di sana.Ia kemudian mengaku baru selesai mandi dan hendak mengambil pakaian yang berada di lemari dalam kamar orang tuanya. ""Itu posisinya mami aku lagi ada kerjaan di luar. Di rumah itu kalau enggak salah cuma ada kakak sama adik aku,"" klaim anak perempuan itu."" Itu aku abis mandi, keluar pakai handuk. Nah waktu itu lemari aku ada di kamar mami kan, di situ aku tahunya cuma ada kakak sama adik aku, jadi enggak ada orang lagi di rumah,"" ia bercerita. Kala keluar dari kamar mandi, baru lah ia menyadari bahwa ayah tiri berada di rumah, bahkan ada di balik pintu kamar sang ibu dan melakukan kejadian tak senonoh tersebut. ""Jadi kayak kasurnya itu di balik lemari, dan tiba-tiba ada suaminya mami aku. Dan di situ lah kejadian. Dan pas pertama kali kejadiannya aku benar-benar kaget,"" ungkapnya. ""Aku kayak terpaku, nge-freeze, karena syok dengan situasinya. Karena di situ aku juga enggak ngerti dengan hal-hal seperti itu kan di waktu itu,"" jelasnya. Kejadian itu diklaim terjadi terus menerus dalam lima bulan. Selama itu,ia mengaku tidak berani menceritakan kepada keluarganya karena merasa tidak terlalu dekat dengan ibu maupun kakak dan adiknya. Setelah lima bulan,ia baru memberanikan diri untuk bercerita ke ibunya. Cerita tersebut tak langsung dipercaya Pinkan Mambo",Keluarga
Tersangka Pemerkosa Anak Tewas Dikeroyok Sesama Tahanan Polres Depok,"Senin, 10 Jul 2023 15:27 WIB",https://www.cnnindonesia.com/nasional/20230710151032-12-971639/tersangka-pemerkosa-anak-tewas-dikeroyok-sesama-tahanan-polres-depok,"Tersangka Pemerkosa Anak Tewas Dikeroyok Sesama Tahanan Polres Depok. Seorang pria berinisial AR (51), tersangka kasusa pemerkosaan terhadap anak kandung meninggal dunia usai diduga dikeroyok oleh sesama tahanan di Polres Metro Depok. Sebelumnya polisi menangkap dan menahan ARa akibat tindak pidana kekerasan seksual yang dilakukannya pada Rabu (5/7). Sementara aksi pengeroyokana berujung maut itu diduga terjadi pada Sabtu (8/7). ""Ada 8 orang yang sudah ditetapkan tersangka,"" kata Wakasat Reskrim Polres Metro Depok Kompol Nirwan Pohan kepada wartawan, Senin (10/7). Delapan tahanan Polres Depok yang ditetapkan sebagai tersangka pengeroyokan ini masing-masing berinisial MD, EAN, FA, AN, AN, AN, MN, dan FNA. Dari hasil pemeriksaan, kata Nirwan, aksi pengeroyokan ini diduga terkait aksi pemerkosaan yang dilakukan AR terhadap anak kandungnya. Hal inilah yang kemudian memicu tersangka mengeroyok korban .""Mungkin para pelaku ini kesal karena dilakukan terhadap anak kandung sendiri, saat ditanya, kasusnya apa, pencabulan anak kandung sendiri, akhirnya itu menjadi pemicu para pelaku kesal terhadap korban,"" tutur Nirwan. Nirwan mengungkapkan pengeroyokan terhadap korban itu tak hanya menggunakan tangan kosong. Tetapi juga menggunakan pipa air di dalam sel tahanan yang diduga sengaja dipatahkana para tersangka.Pipa sel tahanan itu, lanjut Nirwan, digunakan untuk memukul pantat korban. Selain itu, dada dan punggung korban juga terluka akibat pengeroyokan tersebut. ""Dia (tersangka) motong sendiri, mungkin dipatahin pipa, pipa keran air memang ada di sel,"" ujar Nirwan. Nirwan mengatakan usai pengeroyokan itu korban sempat pingsan. Tahanan yang lain lalu melaporkan korban yang pingsan itu ke petugas jaga dan kemudian dibawa ke rumah sakit. ""Oleh penjaga tahanan dicek dan pada saat itu dibawa ke RS Bhayangkara, Kelapa Dua, Depok. Setelah dilakukan pemeriksaan dokter menyatakan korban meninggal dunia,"" ucap Nirwan. Nirwan menyebut jenazah korban saat ini telah dibawa ke RS Polri Kramat Jati untuk dilakukan autopsi guna memastikan penyebab kematiannya.Atas perbuatan mereka, delapan tersangka pengeroyokan sesama tahanan di Depok tersebut dijerat Pasal 170 ayat (2) butir 3e dan atau Pasal 351 ayat (3) KUH Pidana.",Keluarga
"Bocah di Tangsel Tewas Usai Dianiaya, Ibu Kandung-Ayah Tiri Ditangkap","Selasa, 27 Jun 2023 20:48 WIB",https://www.cnnindonesia.com/nasional/20230627195537-12-967350/bocah-di-tangsel-tewas-usai-dianiaya-ibu-kandung-ayah-tiri-ditangkap,"Bocah di Tangsel Tewas Usai Dianiaya, Ibu Kandung-Ayah Tiri Ditangkap. Seorang anak laki-laki berusia empat tahun di Tangerang Selatan (Tangsel) meninggal dunia usai menjadi korban penganiayaan. Korban sempat dirawat di RSUa Tangsel pada Selasa (21/6) lalu. Namun, usai dirawat korban akhirnya dinyatakan meninggal dunia. ""Bayi tersebut mengalami banyak luka di tubuhnya sehingga mendapatkan perawatan di RSU Tangsel,"" kata Humas Polres Tangsel Ipda Galih dalam keterangannya, Selasa (27/6). Dari asil penyelidikan Unit PPA Sat Reskrim Polres Tangsel,a polisi menangkap ibu kandunga dan ayah tiri korban. ""Melakukan penangkapan terhadap pelaku yang melakukan kekerasan terhadap anak yang diduga dilakukan oleh Ibu kandung inisial AZ dan bapak tiri inisial D,"" ucap Galih.Lebih lanjut, Galih menyampaikan saat ini penyidik masih melakukan pendalaman terkait kasus tersebut. Jenazah korban, kata dia, saat ini juga sedang dilakukan proses autopai. ""Selanjutnya terhadap jenazah sudah dibawa ke RS Fatmawati Jaksel untuk dilakukan autopsi,"" ujarnya.",Keluarga
Bocah 8 Tahun di Sumut Dicabuli Kakek dan Diperkosa Ayah Kandung,"Selasa, 20 Jun 2023 14:02 WIB",https://www.cnnindonesia.com/nasional/20230620133548-12-964252/bocah-8-tahun-di-sumut-dicabuli-kakek-dan-diperkosa-ayah-kandung,"Bocah 8 Tahun di Sumut Dicabuli Kakek dan Diperkosa Ayah Kandung . Seorang anak di bawah umur mendapatkan perlakuan kekerasan seksual dari kerabatnya sendiri di Kabupaten Toba, Sumateraa Utara (Sumut). Bocah berusia 8 itu diperkosa ayah kandungnya, SM (34). Tak hanya itu, korban juga dicabuli kakek kandungnya, DM (60). ""Jadi, (pelakunya) orang tua kandung SM dan kakeknya DM. Korban usia delapan tahun,"" kata Kasi Humas Polres Toba AKP Bungaran Samosir, Selasa (20/6). Bungaran mengatakan aksi kedua pelaku itu terungkap usai korban menceritakan perbuatan bejat ayah dan kakeknya kepada teman-temannya. Setelah itu, teman korban bercerita kepada kedua orang tua mereka. Alhasil, orang tua dari teman korban tersebut melaporkan kedua pelaku ke Polres Toba, Minggu (18/6). Pihak kepolisian yang menerima laporan itu langsung bergerak untuk menangkap kedua pelaku. ""Kami langsung mengamankan kedua tersangka dan sekarang sudah ditahan di Polres Toba,"" jelasnya. Berdasarkan hasil pemeriksaan, pelaku SM telah berulang kali menyetubuhi anaknya sejak Oktober 2022. Aksi bejat itu dilakukannya di dalam rumah mereka. ""Pelaku tega mencabuli putri kandungnya sendiri hingga berulang kali sejak Oktober 2023, dengan dalih agar korban cepat besar. Korban pun diminta melakukan tindakan tak senonoh lalu berlanjut disetubuhi pelaku,"" kata Bungaran. Sementara pelaku DM mengaku hanya mencabuli cucunya, tidak sampai menyetubuhi. Aksi bejat itu juga dilakukannya di rumah tersebut. DM mencabuli cucunya dengan modus meminta korban untuk mengusap-usap atau mengusuka dengan alasan sakit. ""Dengan alasan perut sakit, pelaku DM meminta korban untuk mengusuk perutnya. Setelah itu, pelaku tega melakukan tindakan pencabulan terhadap korban,"" ujarnya. Menurut keterangan para pelaku, mereka hanya tinggal dengan korban dan nenek korban di rumah tersebut. SM diketahui telah bercerai dengan istrinya sejak lima tahun lalu. Sementara, nenek korban saat kejadian diketahui tengah tidak berada di rumah. Nenek korban tengah pergi mengunjungi kerabatnya di Torganda sejak tiga bulan lalu. Pada saat itulah, para pelaku melakukan aksi bejatnya kepada korban. ""Keadaan rumah yang sepi dimanfaatkan pelaku untuk melakukan tindakan pencabulan dan persetubuhan terhadap putri kandungnya tersebut,"" jelasnya. Atas perbuatannya, para pelaku dijerat Pasal 81 dan Pasal 82 Undang-undang Nomor 17 tahun 2016 tentang Perlindungan Anak. Sementara terhadap korban saat ini telah ditempatkan di rumah aman yang disediakan oleh Pemkab Toba. ""Korban kini sudah kita tempatkan di rumah aman yang disiapkan oleh pihak Pemkab. Kita juga tetap berkoordinasi dengan dokter untuk memantau kesehatan dan psikologis si anak,""a kata Bungaran",Keluarga
Ayah Aniaya Anak Kandung di Apartemen Jaksel Divonis Dua Tahun Bui,"Senin, 19 Jun 2023 19:34 WIB",https://www.cnnindonesia.com/nasional/20230619185351-12-963936/ayah-aniaya-anak-kandung-di-apartemen-jaksel-divonis-dua-tahun-bui,"Ayah Aniaya Anak Kandung di Apartemen Jaksel Divonis Dua Tahun Bui - Raden Indrajana Sofiandi terdakwaa penganiayaan terhadap anak kandung di Jakarta Selatan divonis hakim Pengadilan Negeri Jakarta Selatan (PN Jaksel) 2 tahun penjara. Hakim menjatuhkan vonis 2 tahun penjara terhadap Indrajana setelah ia terbukti secara sah dan meyakinkan melakukan kekerasan terhadap anaknya. ""Mengadili, memutuskan menjatuhkan pidana penjara kepada terdakwa Raden Indrajana Sofiandi selama dua tahun,"" kata Ketua Majelis Hakim PN Jaksel, di Ruang Sidang 02, Senin (19/6). Tak hanya itu, Indrajana juga dijatuhi vonis hukuman denda Rp50 juta subsidair empat bulan penjara. Vonis tersebut lebih ringan dari jaksa penuntut umum (JPU) yang sebelumnya menuntut Indrajana dihukum 3 tahun penjara. Diketahui penganiayaan tersebut dilakukan terhadap dua korban yakni KR dan KA di sebuah apartemen di Jakarta Selatan. Dalam kasus ini, Indrajana dijerat Pasal 76c Jo Pasal 80 ayat 1 dan ayat 4 UU Nomor 35 Tahun 2014 tentang Perlindungan Anak serta Pasal 44 ayat 1 UU Nomor 23 Tahun 2004 tentang Penghapusan KDRT. Sebelumnya, penganiayaan yang Indrajana lakukan terhadap anaknya sempat viral di media sosial. Wakil Ketua Komisi III DPR, Ahmad Sahroni pun mengunggah dugaan kejadian tersebut di akun Instagram miliknya. Peristiwa terjadi pada tahun 2021 hingga 2022. Terlapor kerap melakukan kekerasan terhadap korban dengan cara memukul kepala korban hingga menendang punggung korban. Dalam kasus ini, Indrajana dijerat Pasal 76c Jo Pasal 80 ayat 1 dan ayat 4 UU Nomor 35 Tahun 2014 tentang Perlindungan Anak serta Pasal 44 ayat 1 UU Nomor",Keluarga
"Perkosa 27 Gadis Remaja, Guru Ngaji di Senegal Ditangkap","Selasa, 06 Jun 2023 09:21 WIB",https://www.cnnindonesia.com/internasional/20230606085913-127-958070/perkosa-27-gadis-remaja-guru-ngaji-di-senegal-ditangkap,"Perkosa 27 Gadis Remaja, Guru Ngaji di Senegal Ditangkap. Seorang guru mengaji di Senegal ditangkap usai diduga memperkosa 27 remaja perempuan. Ia sempat kabur selama beberapa minggu sebelum ditangkap. ""[Dia ditangkap] setelah menyerahkan diri ke polisi. Usai diinterogasi, dia diserahkan ke gendarmerie [penegak hukum],"" kata pejabat polisi di Senegal, seperti dikutip AFP. Pejabat polisi setempat mengatakan pelaku melakukan aksi pelecehan seksual di sekolah di kota Touba, Senegal Tengah. Laporan kekerasan seksual ini muncul setelah korban memberikan sertifikat medis terkait kondisi kesehatan. Tak lama setelah laporan bermunculan, pelaku kabur. Pihak berwenang mengungkap guru tersebut dituduh ""memperkosa 27 siswa"", namun laporan tidak merinci waktu kejadian maupun usia para korban. Namun menurut media lokal, korban diperkirakan anak-anak di bawah umur yang berusia di bawah 15 tahun. Surat kabar Senegal, Le Jour, melaporkan pelecehan terungkap saat salah satu satu remaja perempuan menolak kembali ke tempat mengaji itu. Penolakan tersebut bukan tanpa alasan. Seorang korban mengaku guru mereka ""melakukan hubungan seksual dengan dia dan semua gadis lain"". Touba selama ini dianggap sebagai kota suci oleh Mourides, sebuah persaudaraan Muslim besar di Afrika Barat. Penangkapan terhadap guru ngaji ini muncul beberapa waktu setelah tokoh oposisi Ousmane Sonko dijatuhi hukuman dua tahun penjara karena menghasut perempuan muda untuk ""bersenang-senang. ""Sonko juga sempat dituduh memperkosa perempuan dan menjadi sorotan media selama dua tahun. Namun, dia dibebaskan terkait tuduhan ini.",Tenaga Pendidik
"Kepsek Madrasah di Labura Cabuli 9 Siswi, Ditangkap di Aceh","Selasa, 30 Mei 2023 17:41 WIB",https://www.cnnindonesia.com/nasional/20230530171814-12-955922/kepsek-madrasah-di-labura-cabuli-9-siswi-ditangkap-di-aceh,"Kepsek Madrasah di Labura Cabuli 9 Siswi, Ditangkap di Aceh. Kepala Sekolah Madrasah Diniyah Tsanawiyah Awaliyah (MDTA) Al Washliyah Adian Torop di Kecamatan Aek Natas, Kabupaten Labuhanbatu Utara (Labura), Sumatera Utara, berinisial PH (40) didugaa mencabuli sembilan orang siswi. Ia telah ditetapkan sebagai tersangka dan ditahan polisi. ""PH telah ditetapkan sebagai tersangka dan ditahan karena melakukan pencabulan terhadap sembilan orang anak didiknya. Yang bersangkutan ditangkap di Aceh Tamiang,"" kata Kapolres Labura AKP Rusdi Marzuki, Selasa (30/5).Rusdi menjelaskan pencabulan terhadap sembilan siswi di bawah umur itu terjadi dalam kurun waktu tahun 2020 sampai Mei 2023. PH melakukan aksinya di lingkungan sekolah, di antaranya di kantor guru MTs Al Washliyah Adian Torop, kantin, dan aula MDTA.Ia menuturkan pencabulan itu terbongkar pada 21 Mei 2023 sekitar pukul 14.00 WIB. Saat itu, salah satu korban akan mengikuti pembelajaran di kelas. Namun sebelum masuk kelas, korban bertemu dengan PH di kantin. PH memanggil korban dan memintanya memijat. Di kantin yang sedang sepi itu, PH langsung tidur dengan posisi telungkup. Lalu, korban memijat punggung PH. ""Setelah itu, PH berbalik badan dan seolah olah ingin mengajari korban cara memijat. Lalu korban pun disuruh tidur telungkup dan dipijat oleh PH dengan kedua tangannya. Dan PH langsung mencabuli korban,"" kata Rusdi. Rusdi menuturkan aksi PH dilihat salah seorang siswa yang saat itu masuk ke kantin. PH langsung berdiri dan pura pura mengemasi jajanan di kantin.Sedangkan korban lari dan bergegas pulang ke rumah. Korban menangis dan menceritakan peristiwa tersebut kepada orang tuanya. ""Orang tua korban melaporkan kasus itu ke Polres Labura. Berdasarkan hasil pengembangan yang dilakukan ternyata korbannya bukan hanya satu orang, tapi ada sembilan orang,"" ucapnya. Rusdi mengatakan sejauh ini korban yang diketahui terdiri dari enam siswi MDTA dan tiga siswi MTs. Menurutnya, berdasarkan visum, dua korban kemungkinan mengalami luka trauma benda tumpul di area vital.Rusdi mengatakan PH melakukan perbuatannya dengan berbagai modus, mulai dari membujuk hingga mengancam korban. ""Perbuatan pencabulan ini telah dilakukan oleh PH sebanyak kurang lebih 22 kali dengan sembilan korban anak. Hingga saat ini petugas masih melakukan pengembangan terhadap kemungkinan bertambahnya jumlah korban,"" katanya. Menurutnya, sudah ada lebih dari 20 saksi yang diperiksa terkait kasus pencabulan ini. Para korban juga mendapatkan pemulihan trauma. PH dijerat dengan Pasal 82 Ayat 1, 2, 4 juncto Pasal 76E UU Nomor 17 Tahun 2016 tentang Penetapan Perppu Nomor 1 Tahun 2016 tentang Perubahan Kedua atas UU RI Nomor 23 Tahun 2002 tentang Perlindungan Anak, dan/atau Pasal 6 Huruf c UU Nomor 12 Tahun 2022 tentang Tindak Pidana Kekerasan Seksual juncto Pasal 64 Ayat 1 KUHP. ""Ancaman hukumannya paling lama 15 tahun penjara dan denda paling banyak Rp 5 miliar. Selain itu ancaman hukuman ditambah sepertiga karena dilakukan oleh pendidik, tenaga kependidikan (Pasal 82 Ayat 2) dan menimbulkan korban lebih dari satu orang (Pasal 82 Ayat 4),"" kata Rusdi.",Tenaga Pendidik
Kasus Penganiayaan Siswi SMA di Tasikmalaya Naik ke Tahap Penyidikan,"Kamis, 25 Mei 2023 01:25 WIB",https://www.cnnindonesia.com/nasional/20230525003719-12-953684/kasus-penganiayaan-siswi-sma-di-tasikmalaya-naik-ke-tahap-penyidikan,"Kasus Penganiayaan Siswi SMA di Tasikmalaya Naik ke Tahap Penyidikan. Kasus dugaan penganiayaan seorang siswi di sebuaha SMA Negeri di Kota Tasikmalayaa telah naik ke tahap penyidikan.Kapolres Tasikmalaya Kota AKBP SY Zainal Abidin menjelaskan hasil dari gelar perkara, pihaknya telah menetapkan pelaku sebagai anak berkonflik dengan hukum. ""Sekarang perkaranya sudah naik dari penyelidikan menjadi penyidikan "" ujar Zainal di Mapolres Tasikmalaya Kota, Rabu (24/5). Zainal mengatakan telah mengumpulkan alat bukti, seperti hasil visum dan keterangan dari beberapa saksi.Lalu, pihak kepolisian menerapkan Pasal 80 Ayat (1) Undang Undang Nomor 35 tahun 2014 tentang Perlindungan Anak dalam perkara ini. ""Ancaman hukuman 3 tahun 6 bulan penjara,"" kata Zainal.Menurut Zainal, peristiwa dugaan penganiayaan itu terjadi pada Selasa (16/5). Kemudian, orang tua korban membuat laporan polisi (LP) di hari yang sama. Sehari setelaha orang tua korban membuat laporan polisi, kata Zainal, pihak sekolah datang ke Polres Tasikmalaya Kota dan mengajukan restorative justice. Ia mengklaim telah ada kesepakatan dari kedua pihak untuk berdamai. Zainal mengatakan pihaknya bantu memfasilitasi pertemuan tersebut. Kendati demikian, pada Jumat (19/5), pihak sekolah mengadakan pertemuan antara korban dan terlapor, tanpa melibatkan Penyidik Satreskrim Polres Tasikmalaya Kota serta orang tua korban. Hal itu membuat orangtua korban merasa tersinggung . Lalu, ibu korban membuata unggahana di media sosial soal penganiayaan itu kemudian viral. ""Yang bersangkutan segera kami konfirmasi, dan menginginkan laporannya dilanjutkan kembali,"" jelas dia. Karena kasus ini melibatkan anak, Polres Tasikmalaya Kota pun berkoordinasi dengan Komisi Perlindungan Anak Daerah, Peksos dari Dinas Sosial Kota Tasikmalaya serta Balai Pemasyarakatan. ""Ada mekanisme khusus dalam menangani kasus anak yang berkonflik dengan hukum, sehingga pihak Kepolisian tidak melakukan penahanan terhadap terlapor sehingga anak tersebut masih bisa melaksanakan aktivitas seperti biasanya, termasuk bersekolah,"" kata dia. ""Sementara itu untuk perkembangannya nanti, sesuai Pasal 5 Ayat (3) UU Nomor 11 Tahun 2012 tentang Sistem Peradilan Pidana Anak, maka penyidik akan mengutamakan pendekatan Restorative Justice dengan menempuh tahapan diversi antara kedua belah pihak,"" imbuhnya. Sebelumnya, Humas Polres Tasikmalaya Kota Ipda Jajang Kurniawan mengungkap kejadian dugaan penganiayaan terjadi pada Selasa (16/5) pukul 13.30 WIB di ruang kelas. Kabar tentang dugaan kekerasan ini beredar di media sosial Instagram usai diunggah akun @forumwartawanpolri. Unggahan tersebut memuat foto korban dengan penjelasan berupa teks.Korban disebut mendapat tiga jahitan dan memar di tiga titik. CNNIndonesia.com telah meminta izin akun tersebut untuk mengutip unggahan itu. ""Anak wanita saya menjadi korban kekerasan (pemukulan) dari siswa (laki-laki). Saya heran dengan pihak sekolah SMA Negeri Kota Tasikmalaya kenapa tidak melakukan perlindungan terhadap korban wanita dan cenderung membela pelaku?"" katanya. ""Dan keheranan saya terjawab hari ini, anak saya dipanggil ke ruangan guru oleh pihak sekolah dan orangtua pelaku. Menurut saya pertemuan hari ini sudah tidak fair, pelaku (ortu) vs korban (anak). Kesimpulan yang saya terima dari rekaman anak saya selama pertemuan, ternyata orang tua pelaku merupakan orang berpengaruh dan pejabat di Inspektorat Jenderal Kemendikbud. Bagi saya ini pertemuan nggak fair, karena di dalamnya sudah ada unsur intimidasi terhadap anak saya dari orang tua pelaku. Ini sudah tidak lagi menjadi teladan bagi seorang pejabat di instansi pendidikan,"" ""Kenapa Anda lebih fokus membela anak dan menyepelekan posisi korban. Anda tidak perlu arogan dengan jabatan di kementerian karena saya taat dan bayar pajak. Saya minta keadilan selama di sekolah dan proses mediasi dari pihak Humas Polres Tasikmalaya Kota. Komisi Perlindungan Anak Indonesia, korban 3 jahitan memar 3 titik,"" katanya. Kemendikbud Ristek mengklaim sedang mendalami kasus ini bersama sejumlah pihak lain. ""Kemendikbudristek saat ini masih mendalami kasus ini bersama dengan pihak-pihak berwenang lainnya dan berkomitmen untuk mendukung dan menghormati proses investigasi sesuai dengan ketentuan hukum yang berlaku,"" kata Plt. Kepala Biro Kerjasama dan Humas Kemendikbud Ristek Anang Ristanto saat dihubungi, Senin (22/5). Anang mengatakan pihaknya berkomitmen menciptakan pendidikan berkualitas melalui perwujudan lingkungan belajar yang aman dan nyaman. Salah satunya, dengan terciptanya upaya pencegahan dan penanganan kekerasan di satuan pendidikan yang komprehesif.",Teman
"Viral Siswi di Tasikmalaya Dianiaya, Pelaku Diduga Anak Pejabat","Senin, 22 Mei 2023 18:17 WIB",https://www.cnnindonesia.com/nasional/20230522180130-12-952605/viral-siswi-di-tasikmalaya-dianiaya-pelaku-diduga-anak-pejabat,"Viral Siswi di Tasikmalaya Dianiaya, Pelaku Diduga Anak Pejabat. Seorang siswi di sebuah SMA Negeri di Kota Tasikmalayaa diduga menjadi korban kekerasan siswa laki-laki teman sekelasnya.Humas Polres Tasikmalaya Kota Ipda Jajang Kurniawan mengatakan pihaknya telah menerima laporan terkait kasus ini pada Selasa (16/5). ""(Kejadian) Selasa 16 Mei 2023, jam 13.30 WIB di ruang kelasnya. Pada hari itu juga sekitar jam 21.00 WIB, ibu korban melaporkannya ke Polres Tasikmalaya Kota,"" ujar Jajang saat dihubungi, Senin (22/5). Jajang menjelaskan kasus ini ditangani oleh Unit Pelayanan Perempuan dan Anak (PPA) Satreskrim Polres Tasik Kota. Menurut Jajang, kasus masih dalam proses penyelidikan. ""Ya (terduga pelaku) siswa laki-laki dan satu kelas, sama-sama masih di bawah umur. (Statusnya) anak berhadapan dengan hukum,"" kata Jajang. Selain itu, Jajang juga merespons narasi yang menyebut orang tua dari terduga pelaku merupakan pejabat di Inspektorat Jenderal Kemendikbud. Jajang menyebut Penyidik Sat Reskrim Polres Tasik Kota tidak melihat bagaimana latar belakang orang tua anak yang berhadapan dengan hukum. Sebab, kata dia, semua sama kedudukannya di muka hukum. Kabar tentang dugaan kekerasan ini beredar di media sosial Instagram usai diunggah akun @forumwartawanpolri. Unggahan tersebut memuat foto korban dengan penjelasan berupa teks. Korban disebut mendapat tiga jahitan dan memar di tiga titik.CNNIndonesia.com telah meminta izin akun tersebut untuk mengutip unggahan itu. ""Anak wanita saya menjadi korban kekerasan (pemukulan) dari siswa (laki-laki). Saya heran dengan pihak sekolah SMA Negeri Kota Tasikmalaya kenapa tidak melakukan perlindungan terhadap korban wanita dan cenderung membela pelaku?"" ""Dan keheranan saya terjawab hari ini, anak saya dipanggil ke ruangan guru oleh pihak sekolah dan orangtua pelaku. Menurut saya pertemuan hari ini sudah tidak fair, pelaku (ortu) vs korban (anak). Kesimpulan yang saya terima dari rekaman anak saya selama pertemuan, ternyata orang tua pelaku merupakan orang berpengaruh dan pejabat di Inspektorat Jenderal Kemendikbud. Bagi saya ini pertemuan nggak fair, karena di dalamnya sudah ada unsur intimidasi terhadap anak saya dari orangtua pelaku. Ini sudah tidak lagi menjadi teladan bagi seorang pejabat di instansi pendidikan,"" ""Kenapa Anda lebih fokus membela anak dan menyepelekan posisi korban. Anda tidak perlu arogan dengan jabatan di kementerian karena saya taat dan bayar pajak. Saya minta keadilan selama di sekolah dan proses mediasi dari pihak Humas Polres Tasikmalaya Kota. Komisi Perlindungan Anak Indonesia, korban 3 jahitan memar 3 titik,""Kemendikbud Ristek mengaku tengah mendalami kasus ini bersama sejumlah pihak lain. ""Kemendikbudristek saat ini masih mendalami kasus ini bersama dengan pihak-pihak berwenang lainnya dan berkomitmen untuk mendukung dan menghormati proses investigasi sesuai dengan ketentuan hukum yang berlaku,"" kata Plt. Kepala Biro Kerjasama dan Humas Kemendikbud Ristek Anang Ristanto saat dihubungi, Senin (22/5).Anang mengatakan pihaknya berkomitmen menciptakan pendidikan berkualitas melalui perwujudan lingkungan belajar yang aman dan nyaman. Termasuk, kata dia, dengan terciptanya upaya pencegahan dan penanganan kekerasan di satuan pendidikan yang komprehesif.",Teman
