Judul,Tanggal,Link,Isi Berita,Label
Polisi Usut Kasus Bullying Siswi SMP di Bekasi yang Disiarkan Live IG,"Jumat, 14 Jun 2024 14:39 WIB",https://www.cnnindonesia.com/nasional/20240614140017-12-1109934/polisi-usut-kasus-bullying-siswi-smp-di-bekasi-yang-disiarkan-live-ig,"Polisi Usut Kasus Bullying Siswi SMP di Bekasi yang Disiarkan Live IG. Polisi masih mendalami keterangan dari siswi SMP dia Bekasi berinisial FAP (14) korbana perundungan atau bullying yang disiarkan langsung lewat Instagram. Kasat Reskrim Polres Metro Bekasi Kota AKBP Muhammad Firdaus mengatakan kebenaran soal pengakuan korban itu masih menunggu hasil keterangan dari empat terduga pelaku. Rencananya, keempat terduga pelaku itu akan dimintai keterangan oleh penyidik pada Kamis (20/6) pekan depan. ""Benar (tunggu pemeriksaan terduga pelaku soal) keterangan anak sebagai korban kekerasan terhadap anak sebagai korban live di IG,"" kata Firdaus kepada wartawan, Jumat (14/6). Dalam proses pemeriksaan terhadap para terduga pelaku, polisi juga akan mendalami soal motif dari aksi perundungan tersebut. ""Motifnya masih didalami dan menunggu hasil pemeriksaan anak sebagai pelaku,"" ujarnya. Di sisi lain, Firdaus menerangkan aksi bullying itu bermula saat pelaku mengajak korban untuk bermain. Namun, di tengah jalan, ternyata sudah ada pelaku lain yang menunggu korban di Lapangan Poris, Pondok Melati, Kota Bekasi, Jawa Barat. ""Sampai di TKP pelaku langsung menampar korban dan pelaku lainnya memukul korban,"" ucap Firdaus. Akibat perbuatan pelaku, korban mengalami sejumlah luka. Mulai dari memar pada bagian mata kanan sebelah bawah, pelipis kanan bengkak, rahang kiri bengkak, lengan tangan sebelah kiri memar hingga leher sebelah kiri lecet. ""Dan kejadian tersebut direkam dan divideokan oleh pelaku,"" kata dia. Sebelumnya, seorang siswi SMP berinisial FAP (14) menjadi korban aksi perundungan atau bullying di Lapangan Poris, Pondok Melati, Kota Bekasi, Jawa Barat. Aksi bullying itu telah dilaporkan oleh orang tua korban ke kepolisian dan teregister dengan nomor LP/B/3270/VI/2024/SPKT/POLDA METRO JAYA tertanggal 12 Juni 2024.Dalam video beredar, pelaku saat peristiwa terjadi berjumlah enam orang.",Teman
"Kasus Ibu Cabuli Anak Kandung, Polisi Imbau Waspadai Iming-iming Uang","Senin, 10 Jun 2024 04:52 WIB",https://www.cnnindonesia.com/nasional/20240610032505-12-1107801/kasus-ibu-cabuli-anak-kandung-polisi-imbau-waspadai-iming-iming-uang,"Kasus Ibu Cabuli Anak Kandung, Polisi Imbau Waspadai Iming-iming Uang. Polisi mengimbau masyarakat untuk mewaspadai apabila ada pihak yang menjanjikan uang dari para pelaku tindak kejahatan. Imbauan ini diberikan menyusul dua kasusa pencabulana yang dilakukan oleh ibu kepada anak kandungnya usai diiming-imingi uang oleh pelaku. ""Agar berhati-hati dan waspada, serta jangan mudah percaya, tergiur, dan terjebak oleh janji-janji manis ataupun iming-iming diberikan uang dalam jumlah besar. Namun, harus melakukan sesuatu perbuatan yang bertentangan dengan norma hukum, agama, dan sosial di masyarakat,"" kata Direktur Reskrimsus Polda Metro Jaya Kombes Ade Safri Simanjuntak kepada wartawan, Minggu (9/6). Ade Safri menyebut dalam melancarkan aksinya, para pelaku menyuruh korban untuk berfoto dengan memegang KTP di depan dada. Modus ini, kata dia, digunakan pelaku untuk mendapatkan identitas korban. ""Selanjutnya, pelaku kejahatan juga akan menyuruh calon korban untuk foto setengah telanjang atau telanjang dengan iming-iming diberikan uang jutaan rupiah dan selanjutnya mengirim foto tersebut ke pelaku kejahatan,"" ucap dia. Setelah permintaan itu dipenuhi, pelaku kembali menyuruh korban untuk membuat video sedang melakukan hubungan badan. Kemudian, video itu harus dikirimkan kepada pelaku. ""Jika korban menolaknya, maka pelaku kejahatan akan mengancam menyebarkan video setengah telanjang atau telanjang sebelumnya untuk diketahui umum,"" tutur Ade Safri.Diketahui, beberapa waktu lalu polisi menangkap ibu berinisial R (22) karena mencabuli anak kandungnya di Tangerang Selatan. R membuat konten video tak senonoh itu usai dijanjikan uang sebesar Rp15 juta oleh akun Facebook Icha Shakila. Setelahnya, polisi kembali menangkap seorang ibu berinisial AK di Kabupaten Bekasi terkait kasus serupa. Setelah diselidiki, terungkap bahwa AK melakukan aksinya itu karena dijanjikan uang oleh akun Facebook Icha Shakila. Sebagai tindak lanjut, polisi pun telah menemukan seseorang berinisial S selaku pemilik akun Facebook tersebut. Kendati demikian, S mengaku akunnya telah diretas. Kepada polisi, S juga mengaku pernah menjadi korban, sama seperti yang dialami oleh R dan AK. Kala itu, S mengaku dihubungi oleh seseorang berinisial M. ""Diketahui bahwa sekitar September 2021 pemilik akun Facebook Icha Shakila dikirimi pesan oleh orang yang tidak dikenal bernama M (saat ini akun tersebut sudah tidak aktif) dan ditawari untuk melakukan pekerjaan dengan iming-iming dengan bayaran yang besar,"" terang Ade Safri dalam pernyataan tertulis, Sabtu (8/6). Mulanya S diperintahkan untuk mengirim foto setengah badan sambil memegang KTP. Kemudian ia diminta merekam dirinya membuka semua baju dan mengirim videonya. Permintaan ini dituruti S.Tiba pada permintaan berikutnya, S tidak menuruti. Pasalnya, ia diminta merekam saat berhubungan seks. M pun mengancam akan menyebarkan video sebelumnya jika tidak dituruti. ""Setelah pemilik akun FB Icha Shakila tidak menuruti perintah, pemilik akun FB M sempat mengirimkan video (membuka semua pakaian) milik pemilik akun FB Icha Shakila ke suami dan teman-temannya,"" tambahnya.",Keluarga
"KPAI Desak Polisi Tuntaskan Kasus Ibu Cabuli Anak, Duga Ada Sindikat","Sabtu, 08 Jun 2024 07:50 WIB",https://www.cnnindonesia.com/nasional/20240608074453-12-1107368/kpai-desak-polisi-tuntaskan-kasus-ibu-cabuli-anak-duga-ada-sindikat,"KPAI Desak Polisi Tuntaskan Kasus Ibu Cabuli Anak, Duga Ada Sindikat. Ketua Komisi Perlindungan Anak Indonesia (KPAI) mendesak pihak Kepolisian untuk membongkar tuntas sejumlah kasus orang tua yang merekam aksi pencabulan terhadap anak kandungnya sendiri. Ketua KPAI Ai Maryati Solihah menduga dua kasus ibu yang melakukan pencabulan terhadap anaknya baru-baru ini ""ada relevansi"" dengan temuan 2.100 tayangan video porno anak-anak dan jaringan atau sindikat jual-beli video cabul tersebut. ""Kepolisian harus membongkar tuntas dari kasus ini, bukan hanya melihat bahkan masyarakat menghujat si ibu ini,"" kata Ai seperti diberitakan detikcoma pada Jumat (7/6). ""Ada ruang eksploitasi yang bisa saja berpotensi adalah industri pornografi yang sesungguhnya dengan menggunakan orang-orang tidak berdaya ini,"" lanjutnya merujuk kondisi ekonomi pelaku kedua kasus terakhir. Ai menyinggung temuan 2.100 tayangan video porno anak-anak yanga belum lama diungkap dan dilakukan oleh satu orang, yang kemudian membuat grup di media sosial serta menarik duit dari sana. ""Perputaran uangnya menjadi signifikan hampir ratusan juta dalam satu tahun,"" kata Ai soal kasus tersebut.KPAI menilai ada benang merah dari dua kasus ibu merekam perbuatan asusila terhadap anak mereka baru-baru ini, yakni pelaku dalam kasus tersebut merupakan masyarakat dari kelompok ekonomi sulit dan minim menerima edukasi soal kekerasan seksual terhadap anak. ""Siklusnya bisa terlihat menyasar orang yang ekonomi lemah dan edukasi tidak ada,"" kata Ai. Dua kasus tersebut, kata Ai, menambah daftar perkara eksploitasi seksual kepada anak yang diterima KPAI dalam tiga tahun terakhir. Dari 2021 hingga Desember 2023, KPAI menerima 340 kasus aduan terkait eksploitasi seksual kepada anak. ""Jenisnya eksploitasi seksual oleh jaringan dan non-jaringan, ada pekerja anak di dalamnya, dan ada prostitusi online,"" kata Ai. Setidaknya ada dua kasus terlapor dugaan ibu cabuli anak kandung dalam beberapa hari terakhir, yakni di Tangerang Selatan dan Bogor. Pembuatan konten dalam dua kasus tersebut diketahui diperintahkan oleh sebuah akun Facebook dengan iming-iming sejumlah uang. Kasus pertama terjadi di Tangerang Selatan. Ibu R (22) ditetapkan sebagai tersangka kasus dugaan pelecehan seksual terhadap anak kandungnya, R (5).Wadirreskrimsus Polda Metro Jaya AKBP Hendri Umar mengatakan R membuat video pelecehan seksual terhadap anaknya karena kebutuhan ekonomi. R diiming-imingi uang hingga Rp15 juta oleh pemilik akun Facebook, Icha Shalika, untuk konten video yang dibuat. Tak lama setelah ramai kasus di Tangerang Selatan, Polda Metro Jaya kembali menangani kasus serupa. Ibu AK (26) ditangkap atas dugaan pencabulan terhadap anak kandungnya. Sebelumnya, beredar video pencabulan di media sosial yang memperlihatkan ibu bersama seorang anak. AK ditangkap di Cileungsi, Kabupaten Bogor pada Kamis (6/6).Kabid Humas Polda Metro Jaya Kombes Pol Ade Ary Syam Indradi berkata video AK rupanya dibuat juga atas perintah pemilik akun Icha Shakila. Ade menjelaskan awalnya AK melihat beranda Facebook Icha Shakila dan menemukan ada transfer uang sekaligus iming-iming pekerjaan.Berangkat dari dua kasus R dan AK, polisi kini memburu pemilik akun Facebook Icha Shakila.",Keluarga
Kata Psikolog soal Kasus Ibu Lecehkan Anak Kandung di Tangsel,"Senin, 03 Jun 2024 19:15 WIB",https://www.cnnindonesia.com/gaya-hidup/20240603185018-255-1105361/kata-psikolog-soal-kasus-ibu-lecehkan-anak-kandung-di-tangsel,"Kata Psikolog soal Kasus Ibu Lecehkan Anak Kandung di Tangsel. Seorang ibu berinisial R (22) di Tangerang Selatan menjadi sorotan setelah ditetapkan sebagai tersangka atas kasus pelecehan seksual terhadap anak kandungnya, R (5). Kejadian bermula sejak akun Facebook bernama Icha Shakila menjanjikan uang sebesar Rp15 juta kepada R. Saat itu, R ditawari pekerjaan oleh Icha Shakila, yang kemudian memintanya mengirim foto tanpa busana dengan iming-iming akan diberikan sejumlah uang. Karena desakan ekonomi, R pun mengirimkan foto tersebut. Icha Shakila kembali menghubungi R dan meminta untuk membuat video dengan skenario pornografi kepada anaknya R (5). Tersangka diancam akan disebarkan foto bugilnya jika tidak membuat video yang dimaksud. Merasa terancam, R membuat video sesuai permintaan tersebut. Setelah video dikirim, R mencoba menghubungi Icha Shakila, namun tidak berhasil dan uang yang dijanjikan pun tidak pernah diterima. Psikolog anak di Unit Anak dan Remaja Sajiva RSK Jiwa Dharmawangsa Mira Amir mengatakan bahwa faktor ekonomi bisa jadi pemicu tersangka melakukan hal tersebut, tapi tidak menjadi satu-satunya.Mira mengatakan, kondisi terancam dan ketakutan juga berperan besar dalam pengambilan keputusan tersangka. Tersangka takut foto bugilnyaa tersebar hingga ia harus 'mengorbankan' anaknya yang masih balita.Dalam keadaan terancam, lanjut Mira, seseorang tak punya kemampuan untuk menyelesaikan masalahnya secara efektif. ""Lalu akhirnya dia mengambil langkah yang pendek gitu, kan. Dia mengambil keputusan tanpa perhitungan yang matang,"" kata Mira kepada CNNIndonesia.com, Senin (3/6). Selain itu, faktor usia juga dinilai memengaruhi hal ini. Mira mengatakan, ibu muda seperti R mungkin kurang paham mengenai dampak serius dari tindakan tersebut terhadap anaknya.Mira menyatakan bahwa tindakan ini mencerminkan kurangnya literasi mengenai hak anak dan kesadaran akan kekerasan terhadap anak di masyarakat. ""Itu sebenarnya juga mengindikasikan bahwa di masyarakat kita gitu, ya, masih belum sepenuhnya sadar ataupun kesadarannya masih rendah tentang kekerasan terhadap anak,"" ungkapnya. Anak-anak yang mengalami perilaku seperti ini bisa memiliki trauma sepanjang hidupnya. Atau, lebih parah bisa menganggap hal tersebut sebagai hal yang wajar dan berujung pada masalah sosial di masa depan. ""Akhirnya mereka merasa bahwa memperlakukan orang lain seperti itu adalah wajar. Kenapa? Karena itu diberikan dari dia kecil. Jadi habis itu enggak apa-apa. Terbiasa, jadi kayak conditioning atas perilaku yang sebetulnya salah,"" ujar Mira.",Keluarga
Guru di Sukabumi Diduga Aniaya Siswa SD,"Minggu, 02 Jun 2024 07:30 WIB",https://www.cnnindonesia.com/nasional/20240602070619-20-1104765/guru-di-sukabumi-diduga-aniaya-siswa-sd,"Guru di Sukabumi Diduga Aniaya Siswa SD. DPRD Kabupaten Sukabumi, Jawa Barat, menyoroti kasus dugaan guru menganiayaa siswa kelas V yang terjadi di salah satu SDN di Desa Cibodas, Kecamatan Palabuhanratu, Kabupaten Sukabumi. ""Kita harus menyikapi kejadian ini secara bijak dan tidak bisa menghakimi sendiri untuk menentukan siapa yang benar ataupun salah. Tentunya aksi kekerasan ini terjadi karena ada pemicu, sehingga harus dilihat dari dua sisi,"" kata Anggota Komisi IV DPRD Kabupaten Sukabumi Usep Wawan, di Palabuhanratu, Kabupaten Sukabumi, Sabtu (/6) mengutip Antara. Menurut Usep Wawan, terjadinya kasus penganiayaan ini pun harus dilihat dari sebab dan akibat, apakah terjadinya kekerasan ini murni karena ulah oknum guru tersebut atau dipicu oleh kenakalan siswa yang menjadi korban penganiayaan. Ia menjelaskan tidak menutup kemungkinan, kemarahan guru yang mengajar pendidikan jasmani olah raga dan kesehatan (PJOK) ini memuncak akibat ulah siswa tersebut atau mungkin saja apa yang dilakukan oleh anak itu sudah di luar etika. Namun demikian, pihaknya juga tidak membenarkan apa yang dilakukan oleh oknum guru tersebut kepada muridnya. Di mana informasi yang diterimanya, guru itu menjambak hingga mencekik sampai leher anak didiknya terluka serta mengeluarkan darah. ""Apa yang dilakukan oleh oknum guru ini memang salah karena tidak seharusnya melakukan kekerasan terhadap muridnya sendiri apalagi dilakukan di lingkungan sekolah, tetapi kita tidak bisa semena-mena menyalahkannya tetapi harus adil menyikapi permasalahan ini,"" katanya. Ia berharap kasus ini tidak sampai masuk ranah hukum dan bisa diselesaikan secara kekeluargaan. Karena itu evaluasi kinerja bagi para tenaga pendidik di Kabupaten Sukabumi harus rutin dilakukan baik oleh Dinas Pendidikan Kabupaten Sukabumi maupun pihak sekolah yang menjadi tempat mengajar guru tersebut.",Tenaga Pendidik
Anak Korban Prostitusi Surabaya Dipaksa Layani Tamu hingga Jam 3 Pagi,"Selasa, 14 Mei 2024 17:39 WIB",https://www.cnnindonesia.com/nasional/20240514170330-12-1097578/anak-korban-prostitusi-surabaya-dipaksa-layani-tamu-hingga-jam-3-pagi,"Anak Korban Prostitusi Surabaya Dipaksa Layani Tamu hingga Jam 3 Pagi. Sebanyak empat anak korban Tindak Pidana Perdagangan Orang (TPPO) yang dijadikan Pekerja Seks Komersial (PSK) di Surabaya ternyata dipekerjakan tanpa dibayar. Padahal setiap harinya mereka harus melayani 10-20 tamu.Kasat Reskrim Polrestabes Surabaya AKBP Hendro Sukmono mengatakan kasus ini terungkap melalui laporan salah korban di Mapolrestabes Surabaya, dengan nomor LP:442/B/ VI/ RES.1.24/2024/SPKT/POLRESTABES SURABAYA/ POLDA JAWA TIMUR, Senin (6/5).Polisi pun melakukan penyelidikan dan berhasil menangkap YY perempuan 24 tahun asal Kabupaten Ogan Komering Ulu, Sumatera Selatan. Ia dibekuk bersama enam anak buahnya dan empat anak di bawah umur yang ia jadikana PSK. ""Tersangka YY sebagai muncikari dibantu enam tersangka lain sebagai bawahan yang bekerja sebagai admin atau joki dengan peran mencari tamu melalui aplikasi,"" kata Hendro di Mapolrestabes Surabaya, Selasa (14/5). Hendro menuturkan tersangka YY mengendalikan empat orang korban sebagai PSK sejak Januari 2024. Mereka berasal dari Sumatera Selatan dan rata-rata masih berusia 15-17 tahun.Dalam aksinya, YY memesan dua unit di apartemen B di Surabaya sebagai basecamp. Setiap harinya, sejak pukul 12.00 WIB, YY mendatangkan ahli make up untuk merias para korban. Lalu, sekitar pukul 14.00 WIB para tersangka dan korban mulai berpindah menuju hotel yang sudah ditentukan YY. Setibanya di hotel, tersangka YY memesan lima kamar. Empat kamar digunakan sebagai tempat untuk melayani tamu, sedangkan satu kamar lainnya digunakan sebagai kantor para joki sebagai operator untuk mencari tamu melalui aplikasi. ""Rata-rata masing-masing korban melayani 10-20 tamu per hari, dengan jam operasional sejak pukul 15.00-03.00 WIB dini hari. Setelah aktivitas selesai, mereka kembali ke apartemen B,"" ujarnya.Rata-rata tarif yang ditetapkan oleh tersangka YY kepada tamu untuk menerima pelayanan dari para korban, sekitar Rp300 ribu sampai Rp1,3 juta tergantung negosiasi antara joki para pelangganya. ""Namun uang dari semua tamu dikuasai oleh YY, untuk para korban tidak pernah menerima hasil kerjanya. Tersangka YY selalu berdalih bahwa para korban masih mempunyai utang kepada tersangka YY, untuk biaya akomodasi dari Sumsel ke Surabaya, dan biaya hidup sehari-hari,"" katanya. Dengan dalih itu, kata Hendro, para korban dipaksa untuk terus bekerja guna melunasi utanga kepada tersangka YY. Padahal awalnya mereka diiming-imingi gaji Rp200 ribu per hari.Sementara para admin atau joki memperoleh komisi dari YY, mulai dari Rp75 ribu sampai dengan Rp450 ribu berdasarkan uang yang dihasilkan dari tarif setiap aktivitas prostitusi tersebut. Dalam kasus ini Polrestabes Surabaya pun telah menetapkan tujuh tersangka. Yakni YY sebagai muncikari utama. Lalu para admin atau joki RS, AM, SS, RI, AS dan satu lagi anak laki-laki di bawah umur. Polisi juga menemukan bahwa para anak-anak itu dianiaya oleh tersangka YY. Hendroa mengatakan hal itu terungkap dari laporan korban yang mengaku sudah dianiaya YY dan enam anak buahnya. Usai mengalami penganiayaan, salah satu korban melarikan diri dari apartemen yang disewa YY sebagai basecamp. Dia lalu meminta pertolongan ke seseorang untuk melaporkan kejadian ini ke Polrestabes Surabaya. ""Kejadian bermula saat pelapor bertemu dengan korban yang meminta pertolongan usai dianiaya tersangka YY dan enam orang admin joki,"" kata Hendro. Hendro mengatakan, pelapor merasa iba, hingga mengantarkan korban ke kantor SPKT Polrestabes Surabaya. Laporannya pun diterima dengan nomor LP: 442/B/ VI/ RES.1.24/2024/SPKT/POLRESTABES SURABAYA/ POLDA JAWA TIMUR, Senin (6/5). ""Berdasarkan hasil penyelidikan, dan gelar perkara, ditemukan adanya bukti permulaan [penganiayaan] yang cukup, sehingga meningkatkan status perkara ke tahap penyidikan,"" ucapnya. Dalam tahap penyidikan, kata Hendro, terdapat dua alat bukti yang sah, sehingga penyidik meningkatkan status para terlapor menjadi tersangka termasuk dugaan pidana perdagangan orang atau anak. ""Selain kekerasan fisik terhadap anak, diduga ada tindak pidana perdagangan anak di bawah umur,"" ujar dia. Atas perbuatannya para tersangka terancam Pasal 2 dan Pasal 17 UU No 21 tahun 2007 tentang TPPO dan atau Pasal 88 dan Pasal 80 UU No 35 tahun 2014 tentang Perubahan kedua atas UU No. 23 tahun 2002 tentang Perlindungan anak dan atau pasal 296 KUHP. ""Adapun ancaman hukumannya terkait pasal TPPO minimal 3 tahun, maksimal 15. Untuk pasal perlindungan anak ancaman hukumannya minimal 3 maksimal hingga 10 tahun,"" ujar Hendro. Sementara ini empat anak yang jadi korban masih menjalani rehabilitasi dan pembinaan Dinas Perlindungan Perempuan dan Anak (DP3A) Provinsi Jawa Timur.",Orang asing
Cerita Pilu Gadis Tasikmalaya Dilecehkan via Mobile Legends,"Rabu, 01 Mei 2024 14:10 WIB",https://www.cnnindonesia.com/nasional/20240501123615-12-1092610/cerita-pilu-gadis-tasikmalaya-dilecehkan-via-mobile-legends,"Cerita Pilu Gadis Tasikmalaya Dilecehkan via Mobile Legends . Gadis berumur 13 tahun di Tasikmalaya, Jawa Barat, menjadi korban pelecehan seksual yang dilakukan oleh pria berinisial YPS (27), kenalan di aplikasi game Mobile Legends: Bang Bang. Kepala Bidang Humas Polda Jabar Kombes Pol Jules Abraham Abast, ditemui di rilis kasus di Gedung Direktorat Reserse Kriminal Khusus (Ditreskrimsus) Polda Jabar, Bandung, Rabu (1/5), menuturkan pelaku mulanyaa mengirimkan korban foto-foto asusila lewat WhatsApp. YPS kemudian meminta korban mengirimkan foto dan video sejenis. Kasus pelecehan seksual inia puna diketahui orang tua korban yang kemudian melapor ke kepolisian. Polisi pun melakukan penyelidikan. Hasilnya, pelaku diketahui berada di Deli Serdang, Sumatera Utara. Penyidik dari Ditreskrimsus Polda Jabar bersama dengan Bareskrim Mabes Polri dan Polda Sumatra Utara bersama-sama melakukan penangkapan terhadap pelaku. Pada Senin (29/4) malam, pelaku berhasil ditangkap tanpa perlawanan oleh kepolisian. Dari hasil pemeriksaan, diketahui korban dan pelaku saling berkenalan sejak Februari 2024. Pelecehan yang dilakukan pelaku, diketahui mulai terjadi pada awal April 2024. ""Jika kemauan pelaku tidak dipenuhi, pelaku mengancam (korban) dengan cara melukai diri sendiri dengan mengirimkan tangan (pelaku dengan kondisi) terluka atau berdarah,"" katanya. Pada kasus ini, polisi menerapkan pasal 45 ayat (1), pasal 27 ayat (1) Jo pasal 29 Jo pasal 45B dan atau pasal 52 ayat (1) UU Informasi dan Transaksi Elektronik (ITE), dan atau pasal 4, pasal 5 UU Tindak Pidana Kekerasan Seksual, dan atau pasal 82 UU Perlindungan Anak.Ancaman pidananya di atas 5 tahun penjara.",Teman
Perkara Bullying di Binus Serpong Dilimpahkan ke Kejaksaan,"Minggu, 28 Apr 2024 14:07 WIB",https://www.cnnindonesia.com/nasional/20240428132340-12-1091403/perkara-bullying-di-binus-serpong-dilimpahkan-ke-kejaksaan,"Perkara Bullying di Binus Serpong Dilimpahkan ke Kejaksaan. Polres Metro Tangerang Selatan melimpahkan berkas perkara kasus perundungan atau bullying di Binus School Serponga yang melibatkan anak artis Vincent Rompiesa ke kejaksaan. Kasie Humas Polres Metro Tangerang Selatan AKP Agil mengatakan pelimpahan dilakukan usai seluruh proses penyidikan rampung dilaksanakan.""Update terakhir terkait kasus bullying yang viral saat ini berkas perkara sudah tahap 1 di Kejaksaan untuk diteliti JPU (jaksa penuntut umum),"" ujarnya kepada wartawan, Minggu (28/4). Usai pelimpahan berkas perkara, jaksa peneliti kejaksaan akan memeriksa kelengkapan berkas perkara baik materiel dan formil. Apabila dinyatakan lengkap, maka penyidik akan melakukan pelimpahan tahap dua atau menyerahkan kewenangan tersangka dan barang bukti. Kalau sebaliknya, penyidik mesti kembali melengkapi berkas perkara tersebut. ""Selanjutnya menunggu petunjuk dari JPU,"" ungkapnya. Dalam kasus bullying ini, Polres Metro Tangerang Selatan telah menetapkan empat orang tersangka dan delapan anak berkonflik dengan hukum (ABH). Untuk empat tersangka itu masing-masing berinisial E (18), R (18), J (18) dan G (19). Sedangkan untuk delapan ABH tak dibeberkan identitas. Kasat Reskrim Polres Tangerang Selatan AKP Alvino Cahyadi mengatakan motif perundungan dilakukan berkaitan dengan tradisi tak tertulis untuk masuk dalam geng yang dilakukan di warung belakang Binus School Serpong.Sedangkan untuk motif perundungan kedua diduga karena pelaku tak terima lantaran korban menceritakan kejadian pada 2 Februari kepada sang kakak. Atas perbuatannya para pelaku dijerat dengan Pasal 76C Jo Pasal 80 UU Nomor 35 Tahun 2014 tentang Perlindungan Anak menjadi Undang-undang dan atau Pasal 170 KUHP dan atau Pasal 4 ayat 2 huruf d Jo Pasal 5 UU Nomor 12 Tahun 2022 tentang Tindak Pidana Kekerasan Seksual.",Teman
